{
  "id": "rules.primary-care-test-result-follow-up",
  "version": "0.1.0",
  "rules": [
    {
      "id": "rule.activate.test-result-follow-up",
      "type": "activation",
      "priority": 100,
      "when": {
        "rfe": "rfe.test_result_follow_up"
      },
      "then": {
        "activate_intents": [
          "intent.characterize_result_follow_up",
          "intent.screen_result_follow_up_safety",
          "intent.prepare_result_clinician_handoff"
        ]
      },
      "version": "0.1.0",
      "status": "research_only",
      "provenance": {
        "created_by": {
          "type": "ai",
          "id": "codex-gpt5"
        },
        "created_at": "2026-07-14T00:00:00Z",
        "source_refs": [
          "specifications/reasoning-loop.md"
        ],
        "review_status": "unreviewed",
        "version": "0.1.0"
      }
    }
  ],
  "provenance": {
    "created_by": {
      "type": "ai",
      "id": "codex-gpt5"
    },
    "created_at": "2026-07-14T00:00:00Z",
    "source_refs": [
      "specifications/reasoning-loop.md"
    ],
    "review_status": "unreviewed",
    "version": "0.1.0"
  }
}
